Id,Category,Sentence,b_pred,e_pred,l_pred
8667,1,"Feels like the work of someone who may indeed have finally aged past his prime ... and , perhaps more than he realizes , just wants to be liked by the people who can still give him work .",1,2,1
8674,2,"Works because we 're never sure if Ohlinger 's on the level or merely a dying , delusional man trying to get into the history books before he croaks .",2,1,2
8783,2,Hilarious musical comedy though stymied by accents thick as mud .,2,1,2
8784,2,"Although melodramatic and predictable , this romantic comedy explores the friendship between five Filipino-Americans and their frantic efforts to find love .",2,3,2
8788,0,This thing is just garbage .,0,1,0
8801,4,Begins like a docu-drama but builds its multi-character story with a flourish .,4,3,4
8817,4,"There are n't too many films that can be as simultaneously funny , offbeat and heartwarming -LRB- without a thick shmear of the goo , at least -RRB- , but `` Elling '' manages to do all three quite well , making it one of the year 's most enjoyable releases .",4,3,4
8821,2,"One of those based-on-truth stories that persuades you , with every scene , that it could never really have happened this way .",2,3,2
8822,2,Wait for pay per view or rental but do n't dismiss BarberShop out of hand .,2,1,2
8824,2,Matches neorealism 's impact by showing the humanity of a war-torn land filled with people who just want to live their lives .,2,3,2
8843,3,They can and will turn on a dime from oddly humorous to tediously sentimental .,3,2,3
8886,0,"We never truly come to care about the main characters and whether or not they 'll wind up together , and Michele 's spiritual quest is neither amusing nor dramatic enough to sustain interest .",0,1,0
8936,2,"It pulls the rug out from under you , just when you 're ready to hate one character , or really sympathize with another character , something happens to send you off in different direction .",2,1,2
8970,0,The first Fatal Attraction was vile enough .,0,1,0
9015,1,"I walked away not really know who `` they '' were , what `` they '' looked like .",1,2,1
9036,1,A rude black comedy about the catalytic effect a holy fool has upon those around him in the cutthroat world of children 's television .,1,3,1
9039,3,Among the many pleasures are the lively intelligence of the artists and their perceptiveness about their own situations .,3,4,3
9086,3,"Could have been crisper and punchier , but it 's likely to please audiences who like movies that demand four hankies .",3,2,3
9089,4,Eric Schweig and Graham Greene both exude an air of dignity that 's perfect for the proud warrior that still lingers in the souls of these characters .,4,3,4
9099,0,"An awful lot like one of -LRB- Spears ' -RRB- music videos in content -- except that it goes on for at least 90 more minutes and , worse , that you have to pay if you want to see it .",0,1,0
9116,1,"If you want a movie time trip , the 1960 version is a far smoother ride .",1,3,1
9123,2,"The band performances featured in Drumline are red hot ... -LRB- but -RRB- from a mere story point of view , the film 's ice cold .",2,1,2
9147,0,"... has about 3\/4th the fun of its spry 2001 predecessor -- but it 's a rushed , slapdash , sequel-for-the-sake - of-a-sequel with less than half the plot and ingenuity .",0,1,0
9152,2,Like other great documentaries ... this goes after one truth -LRB- the Ford administration 's complicity in tearing ` orphans ' from their mothers -RRB- and stumbles upon others even more compelling .,2,3,2
9214,4,Arguably the best script that Besson has written in years .,4,3,4
9274,1,"With more character development this might have been an eerie thriller ; with better payoffs , it could have been a thinking man 's monster movie .",1,2,1
9283,4,"-LRB- Kline 's -RRB- utterly convincing -- and deeply appealing -- as a noble teacher who embraces a strict moral code , and as a flawed human being who ca n't quite live up to it .",4,3,4
9288,4,"Nair 's cast is so large it 's Altman-esque , but she deftly spins the multiple stories in a vibrant and intoxicating fashion .",4,3,4
9309,2,"I had more fun with Ben Stiller 's Zoolander , which I thought was rather clever .",2,3,2
9323,2,"Somewhere in the middle , the film compels , as Demme experiments he harvests a few movie moment gems , but the field of roughage dominates .",2,3,2
9331,0,To call this film a lump of coal would only be to flatter it .,0,1,0
9355,1,"Chen films the resolutely downbeat Smokers Only with every indulgent , indie trick in the book .",1,2,1
9357,4,This beautifully animated epic is never dull .,4,3,4
9382,2,"With a confrontational stance , Todd Solondz takes aim on political correctness and suburban families .",2,3,2
9384,4,"Tully is worth a look for its true-to-life characters , its sensitive acting , its unadorned view of rural life and the subtle direction of first-timer Hilary Birmingham .",4,3,4
9421,0,"... a cheap , ludicrous attempt at serious horror .",0,1,0
9583,2,"Director Kevin Bray excels in breaking glass and marking off the `` Miami Vice '' checklist of power boats , Latin music and dog tracks .",2,3,2
9651,3,-LRB- Barry -RRB- gives Assassin a disquieting authority .,3,2,3
9657,2,"If Borstal Boy is n't especially realistic , it is an engaging nostalgia piece .",2,3,2
9677,4,Jeffrey Tambor 's performance as the intelligent jazz-playing exterminator is Oscar-worthy .,4,3,4
9692,0,This strenuously unfunny Showtime deserves the hook .,0,1,0
9738,4,"Nicole Holofcener 's Lovely and Amazing , from her own screenplay , jumps to the head of the class of women 's films that manage to avoid the ghetto of sentimental chick-flicks by treating female follies with a satirical style .",4,3,4
9773,4,I love the robust middle of this picture .,4,3,4
9777,2,It 's difficult to discern if this is a crazy work of disturbed genius or merely 90 minutes of post-adolescent Electra rebellion .,2,1,2
9796,0,The disjointed mess flows as naturally as Jolie 's hideous yellow ` do .,0,1,0
9824,1,Lame Sweet Home leaves no Southern stereotype unturned .,1,3,1
9837,2,"A highly personal look at the effects of living a dysfunctionally privileged lifestyle , and by the end , we only wish we could have spent more time in its world .",2,3,2
9872,2,Grainy photography mars an otherwise delightful comedy of errors .,2,1,2
9878,2,"Red Dragon is less baroque and showy than Hannibal , and less emotionally affecting than Silence .",2,1,2
9896,2,A thought-provoking look at how Western foreign policy - however well intentioned - can wreak havoc in other cultures .,2,3,2
9926,4,Mike Leigh populates his movie with a wonderful ensemble cast of characters that bring the routine day to day struggles of the working class to life,4,3,4
9927,1,"The movie spends more time with Schneider than with newcomer McAdams , even though her performance is more interesting -LRB- and funnier -RRB- than his .",1,2,1
9928,2,The plot 's clearly mythic structure may owe more to Disney 's strong sense of formula than to the original story .,2,1,2
9930,2,"A minor work yet there 's no denying the potency of Miller 's strange , fleeting brew of hopeful perseverance and hopeless closure .",2,3,2
9954,1,"Never does `` Lilo & Stitch '' reach the emotion or timelessness of Disney 's great past , or even that of more recent successes such as `` Mulan '' or `` Tarzan . ''",1,2,1
9974,4,"Sillier , cuter , and shorter than the first -LRB- as best I remember -RRB- , but still a very good time at the cinema .",4,3,4
9978,4,"It 's a wonderful , sobering , heart-felt drama .",4,3,4
10047,1,"Contains the humor , characterization , poignancy , and intelligence of a bad sitcom .",1,3,1
10074,2,"The power of this script , and the performances that come with it , is that the whole damned thing did n't get our moral hackles up .",2,3,2
10079,0,There 's surely something wrong with a comedy where the only belly laughs come from the selection of outtakes tacked onto the end credits .,0,1,0
10135,3,Its almost too-spectacular coastal setting distracts slightly from an eccentric and good-naturedly aimless story .,3,1,3
10142,0,"A depraved , incoherent , instantly disposable piece of hackery .",0,1,0
10157,4,"I was amused and entertained by the unfolding of Bielinsky 's cleverly constructed scenario , and greatly impressed by the skill of the actors involved in the enterprise .",4,3,4
10162,2,"`` 13 Conversations '' holds its goodwill close , but is relatively slow to come to the point .",2,1,2
10186,4,Renner carries much of the film with a creepy and dead-on performance .,4,3,4
10206,0,Get out your pooper-scoopers .,0,1,0
10219,1,"Stripped almost entirely of such tools as nudity , profanity and violence , LaBute does manage to make a few points about modern man and his problematic quest for human connection .",1,3,1
10229,0,... pays tribute to heroes the way Julia Roberts hands out awards -- with phony humility barely camouflaging grotesque narcissism .,0,1,0
10291,4,"It 's a hoot watching The Rock chomp on jumbo ants , pull an arrow out of his back , and leap unscathed through raging fire !",4,3,4
10300,2,"The movie ultimately relies a bit too heavily on grandstanding , emotional , Rocky-like moments ... but it 's such a warm and charming package that you 'll feel too happy to argue much .",2,3,2
10303,2,"The doofus-on - the-loose banter of Welcome to Collinwood has a cocky , after-hours loopiness to it .",2,3,2
10308,2,"It 's all gratuitous before long , as if Schwentke were fulfilling a gross-out quota for an anticipated audience demographic instead of shaping the material to fit the story .",2,1,2
10313,2,Confounding because it solemnly advances a daringly preposterous thesis .,2,1,2
10315,0,"Obvious , obnoxious and didactic burlesque .",0,1,0
10335,4,"If you can get past the taboo subject matter , it will be well worth your time .",4,3,4
10337,2,"` All in all , Reign of Fire will be a good -LRB- successful -RRB- rental . '",2,3,2
10339,2,"The film 's best trick is the way that it treats conspiracy as a kind of political Blair Witch , a monstrous murk that haunts us precisely because it can never be seen .",2,3,2
10360,4,Even better than the first one !,4,3,4
10407,2,"I 'm not saying that Ice Age does n't have some fairly pretty pictures , but there 's not enough substance in the story to actually give them life .",2,1,2
10445,2,"The sight of the name Bruce Willis brings to mind images of a violent battlefield action picture , but the film has a lot more on its mind -- maybe too much .",2,1,2
10510,0,"Boll uses a lot of quick cutting and blurry step-printing to goose things up , but dopey dialogue and sometimes inadequate performances kill the effect .",0,1,0
10511,2,An exhilarating serving of movie fluff .,2,3,2
10548,2,"They 're going through the motions , but the zip is gone .",2,1,2
10558,4,The Pianist is Polanski 's best film .,4,3,4
10617,4,One regards Reign of Fire with awe .,4,3,4
10619,4,Amazing !,4,3,4
10622,0,Completely awful Iranian drama ... as much fun as a grouchy ayatollah in a cold mosque .,0,1,0
10637,0,"Certain to be distasteful to children and adults alike , Eight Crazy Nights is a total misfire .",0,1,0
10648,0,Characterisation has been sacrificed for the sake of spectacle .,0,1,0
10652,4,Steven Spielberg brings us another masterpiece,4,3,4
10653,4,"Fairy-tale formula , serves as a paper skeleton for some very good acting , dialogue , comedy , direction and especially charm .",4,3,4
10664,0,The thing just never gets off the ground .,0,1,0
10692,4,Rifkin 's references are ... impeccable throughout .,4,3,4
10708,4,"As quiet , patient and tenacious as Mr. Lopez himself , who approaches his difficult , endless work with remarkable serenity and discipline .",4,3,4
10721,4,"Stanley Kwan has directed not only one of the best gay love stories ever made , but one of the best love stories of any stripe .",4,3,4
10749,4,"It is most remarkable not because of its epic scope , but because of the startling intimacy it achieves despite that breadth .",4,3,4
10779,0,"The title , alone , should scare any sane person away .",0,1,0
10783,2,"Halloween : Resurrection is n't exactly quality cinema , but it is n't nearly as terrible as it cold have been .",2,1,2
10810,2,"Well-meaning to a fault , Antwone Fisher manages the dubious feat of turning one man 's triumph of will into everyman 's romance comedy .",2,3,2
10821,0,"A depressingly retrograde , ` post-feminist ' romantic comedy that takes an astonishingly condescending attitude toward women .",0,1,0
10829,3,An old-fashioned drama of substance about a teacher 's slide down the slippery slope of dishonesty after an encounter with the rich and the powerful who have nothing but disdain for virtue .,3,1,3
10832,1,The movie 's vision of a white American zealously spreading a Puritanical brand of Christianity to South Seas islanders is one only a true believer could relish .,1,3,1
10847,3,"An unflinching , complex portrait of a modern Israel that is rarely seen on-screen .",3,4,3
10915,0,"The movie has a script -LRB- by Paul Pender -RRB- made of wood , and it 's relentlessly folksy , a procession of stagy set pieces stacked with binary oppositions .",0,2,0
10934,0,But the movie that does n't really deliver for country music fans or for family audiences,0,1,0
10945,4,It 's dark but has wonderfully funny moments ; you care about the characters ; and the action and special effects are first-rate .,4,3,4
10946,4,"Poignant and moving , A Walk to Remember is an inspirational love story , capturing the innocence and idealism of that first encounter .",4,3,4
10953,4,"Humorous and heartfelt , Douglas McGrath 's version of ` Nicholas Nickleby ' left me feeling refreshed and hopeful .",4,3,4
10959,0,"So muddled , repetitive and ragged that it says far less about the horrifying historical reality than about the filmmaker 's characteristic style .",0,1,0
11002,3,"George Clooney , in his first directorial effort , presents this utterly ridiculous shaggy dog story as one of the most creative , energetic and original comedies to hit the screen in years .",3,4,3
11010,1,Boyd 's screenplay -LRB- co-written with Guardian hack Nick Davies -RRB- has a florid turn of phrase that owes more to Guy Ritchie than the Bard of Avon .,1,3,1
11058,2,"Rob Schneider , Dana Carvey and Sarah Michelle Gellar in The Philadelphia Story ?",2,3,2
11061,2,Nachtwey clears the cynicism right out of you .,2,3,2
11076,2,It 's too bad that the rest is n't more compelling .,2,1,2
11080,2,But I do .,2,3,2
11095,0,The problem is that it is one that allows him to churn out one mediocre movie after another .,0,1,0
11106,2,A dopey movie clothed in excess layers of hipness .,2,1,2
11114,0,There 's only one way to kill Michael Myers for good : stop buying tickets to these movies .,0,1,0
11171,4,"That rare movie that works on any number of levels -- as a film of magic and whimsy for children , a heartfelt romance for teenagers and a compelling argument about death , both pro and con , for adults .",4,3,4
11174,4,"All in all , Brown Sugar is a satisfying well-made romantic comedy that 's both charming and well acted .",4,3,4
11223,2,The movie is essentially a series of fleetingly interesting actors ' moments .,2,1,2
11253,4,"It 's a lovely , sad dance highlighted by Kwan 's unique directing style .",4,3,4
11271,4,"The problems and characters it reveals are universal and involving , and the film itself -- as well its delightful cast -- is so breezy , pretty and gifted , it really won my heart .",4,3,4
11297,2,"Cockettes has the glorious , gaudy benefit of much stock footage of Those Days , featuring all manner of drag queen , bearded lady and lactating hippie .",2,3,2
11344,4,"A must for fans of British cinema , if only because so many titans of the industry are along for the ride .",4,3,4
11427,4,The script by David Koepp is perfectly serviceable and because he gives the story some soul ... he elevates the experience to a more mythic level .,4,3,4
11471,2,The party scenes deliver some tawdry kicks .,2,1,2
11518,0,Not at all clear what it 's trying to say and even if it were -- I doubt it would be all that interesting .,0,1,0
11529,1,Imagine Susan Sontag falling in love with Howard Stern .,1,2,1
