Id,Category,Sentence
7676,3,It's a solid film about people whose lives are far from quiet.
7678,4,"Call it magical realism or surrealism, but Miss Wonton escapes reality with a degree of wit and dignity."
7679,1,Where the movie falters is in the tone.
7680,2,"Then again, maybe Nadia's birthday wasn't a bad day after all."
7681,3,A French film with a rather down-to-earth flavour.
7683,4,A must for all sides of the political spectrum
7685,1,"die-hard slasher fans will appreciate, but the Halloween show has lost its edge overall."
7686,4,"This is a finely written, superbly acted, wacky thriller."
7687,0,"It's quite an achievement to play and make a film at the Cannes Film Festival, yet still take away from the film the visual appeal or the atmosphere."
7688,1,Despite the excessive dose of farcical performances and directorial instructions he is surprisingly bland.
7689,4,"With Alexandre Desplat's haunting and grandeur, the film is an intoxicating interpretation of listeners."
7693,4,"The wonderful film I'm Going Home is so evocative, yet brimming with wisdom and emotion."
7696,0,One of the most unpleasant things the studio has ever produced.
7697,3,"Nor ""Shrek"" or ""Monster, Inc.,"" but it's not that bad."
7699,3,"Beyond Rohmer's courageous decision, The Lady and the Duke represents the filmmaker's lifelong occupation with formal experimentation in the art of cinema."
7700,3,"One leaves his film overwhelmed, hopeful and perhaps paradoxically illuminated."
7702,4,The entire cast is extraordinarily good.
7703,3,"is an excellent compliment to the piece that is also under the theme ""the wife of a French lieutenant."""
7704,4,"It is a bittersweet, contemporary comedy about benevolent fraud that, while its film version may not run parallel to the filmmaker's old-timers, is still much to see."
7705,2,Those of you who don't believe in Santa Claus probably also believe sequels can never capture the magic of the original.
7706,2,A copy of this film was sent to me and it was to be reviewed on DVD.
7707,1,"An unencouraging triple extension of the former MTV series that followed the trick-hungry dopey in a random series of gags, pranks, chees, trolls and injuries."
7708,2,But the process is a flop - except for six gags that really do work.
7709,1,So aggressively cheerful that Pollyana reached for a plastic bag.
7710,4,"I stopped thinking how good everything was and started to do nothing but react to it - I felt myself as a part of these great places, eagerly thinking as the protagonists fought, feeling left at the mercy of its invincibility, I allowed it visual pleasures."
7712,4,"... a pleasantly frothy ""date film""..."
7715,2,"A faulty but admirable film, it seeks to plunge us into a world of artistic doom and political madness, while at the same time almost managing."
7716,2,Stir potentially alluring ingredients into an uncomfortable mixture of Ghost and Close Encounters of the Third Kind.
7719,0,"Slacker and uninspired, populated mostly by characters who have so few sympathies that one gets a sour smack in the mouth."
7720,1,"This adventure offers neither half the excitement of Balto, nor half the fun of Toy Story 2."
7721,3,"He is certainly Convention and predictable but his performances are so off-the-cuff that he does his passage very convincingly, even though he is never as solid as you might wish."
7722,3,"If you have ∩ the right B-movie-mind, it could just put you off."
7723,2,"If you'd given Deuce's Wild a polish, it would have been a camp adventure, one of those movies so bad it feels too good to be true."
7724,4,"Reinforced by a strong, easy-going opening act."
7728,0,"Sheridan seems to be fearful of the book's irreverent energy, and for much of it he can't inspire verve, humour, bile or irony."
7729,2,We must not look to religious fanatics - or backyard gangs - again like before.
7730,0,"For most films, 84 minutes is too little, but this will feel like a life sentence."
7732,3,The leisurely nature of the film is actually one of its strengths.
7733,2,"Your reaction to her revival of ""That"" may well depend on what you thought of the first film."
7735,3,A sound poem of overstepping.
7736,1,When we watch this movie we don't sense tension or excitement first and foremost.
7737,1,The whole thing looks like a $40 million version of a game you'll probably enjoy on the computer rather.
7738,1,"Deadly boring, pointless meditation on losers in an extinct hotel."
7739,2,The whole thing is rather tame.
7740,3,"A duly operated on nail balm, with a good chance of being Franklin's greatest hit, needs to stay afloat in Hollywood."
7743,3,"The film keeps its promise: a look at the ""wild ride"" that occurs as sassy young men begin to conquer the online world with laptops, cell phones and sketchy business plans."
7745,1,A moving image that does not move.
7747,3,The performances all round are superb: the two lead roles deliver appearances with Oscar format.
7748,4,"If ""Lilo & Stitch"" isn't the most edgy feature of Disney's animation series, this first watercolor-backdrop movie since 將 ""Dumbo"" is certainly the most memorable."
7751,1,It is hell of an experience to witness and there is no shortcut to understanding that was not discussed extensively in the press in the heyday of Dahmer in the mid-1990s.
7752,3,The crafty director Robert J. Siegel and his co-writers keep the plot subtle and suspense.
7753,3,"Just what its title means: haunting, impetuous and utterly charming."
7754,4,"Like a great meal, Red Dragon -- with its mature recipe, inspiring ingredients, certified cuisine and flavorful presentation."
7758,1,No amount of good acting is enough to save OleSanders' uninspired story.
7759,3,"It's lost, but fortunately there's little left for residents to do other than embrace the ""real-world dichotomy"" - LRB - Jaglom - RRB - pursued with such jaundiced determination in Venice."
7760,1,"It's all still all too familiar... basically a kind of cautionary tale that was old when ""Angels With Dirty Faces"" was released in 1938."
7761,3,Aniston has recently made a decisive break from her boyfriend's image in an independent Australian film riddled with satirical fire and emotional turmoil.
7762,1,"""Looking For Leonard"" looks somehow neutral, hoping for a stiff wind blowing him up the mountain or something."
7764,1,Officially it's twice as beastly but half as witty.
7765,3,"If -LRB- Jaglam- RRB- is not the best director, then there is something about his singing that should be heard."
7769,1,"Unfortunately, we would rather just keep things simple."
7771,3,I was struck by how many retaliatory measures den filmmakers allow before pulling the plug on the conspirators and preventing an American-Russian goddess dawn.
7772,3,"This is funny, clever, clever, and surprisingly innocuous for a film about a teen who falls in love with his stepmother."
7773,1,"Until this miraculous ending is known, it will be impossible to rekindle interest."
7774,2,"""Murder by Numbers"" may not be a great movie but it is a perfectly acceptable widget."
7779,0,"""Sorority Boys"" was funnier, and the movie was pretty bad."
7780,4,"Never again is this romantic comedy, by turns touching, bluntly entertaining, uncomfortable and, yes, even sexy, a welcome and heartwarming addition."
7782,0,"Cheesy, shrill, over-long soap opera."
7783,2,"""It's about the image."" """
7784,0,"Goldmember doesn't have the visual wit of previous recordings, and it seems that Jay Roach steered the film from his taxi rank."
7785,0,Lacks inspiration from the original and has a overfilled plot that extends the running time by about ten minutes beyond a child's interest and the patience of an adult.
7786,3,It is a sumptuous summer blockbuster worth watching.
7789,1,"In The New Man, even the bull is recycled."
7790,1,"LRB - The kid's -RRB- just too bratty for sympathy, and as the movie closes, the small changes facilities ring hollow."
7792,1,"Noble stuff, everything scrambled like a picture paper of a baby, which cannot really tell a science fiction piece apart from another."
7793,1,Its attempts to be alarmist are as predictable as they are spiteful.
7794,1,His message is worthy and may have had a little financial edge at the hands of a brutally upright human being like Ebay.
7795,4,"Lan Yu is a true love story filled with traditional layers of awakening and maturation, separation and recreation."
7796,3,"A strong and confident performance, acknowledged in the first 89 minutes but so desperately confusing in the last two."
7797,4,"s reserved, radiant performance gives us the impression that Lilia wants to free herself from her current life at some elementary level."
7798,1,"As with so many merchandising-to-the-maximum films of this type, more time seems to have gone into recruiting the right bands and costumes for the stars than into the screenplay, which includes a handful of clever jokes and not much else."
7799,1,"4Ever without a fresh infusion of creativity is neither a promise nor a threat, just wishful thinking."
7800,3,"It's as degrading as it's strangely liberating to hear people work so hard to live through sexy intrigue to get exposed as ordinary, pasty nags by the dispassionate Gantz brothers."
7802,1,"? LRB- Franco -RRB- as the sulky, moody, chirpy X. In the title role, he has all of Decan's animosities and exuber眺, but the film retains none of his sweetness and vulnerability."
7803,2,"Amidst cliches and premonitions, Cage succeeds in conveying a certain casual realism... which Blethyn routinely dynamizes."
7805,3,It's better than The Phantom Menace.
7806,0,This child-focused stinker is so bad that I stuck the rubber under my seat and tried to sneak out of the theatre.
7808,0,"The plan to write an inspirational survival story packed in the heartbreaking suspense of a classy psycho-thriller ""is as flaky as a misconstrued soufflé."
7809,1,"Shunji Iwais ""All About Lily Chou Chou is a beautifully shot, but ultimately flawed film about growing up in Japan."
7812,3,"He cooks in a low, rough and inviting sizzling environment."
7814,1,Sluggish pace and a lack of real narrative encompass the film as much as the lives in these young women's heads.
7816,0,No sooner does Ice-T put his mug in the window of the couple's BMW and insult the woman in the course of bad dialogue than his credibility drops.
7818,2,Affleck is merely setting the context for a role he has yet to grow into - one he effortlessly filled with authority.
7819,3,"With this breathtaking odyssey, Payne construtlich a hilarious ode to Middle America and the Middle Ages, in which a pathetic, lovable hero with too much humanity is shown."
7821,0,Crumbly.
7823,1,You don't have to know Cool-J's ice-T's if you want to see that something is rotten about these shootings in the state of California.
7824,4,Seductive and often funny documentary.
7826,4,"This film is terrific, and Salma Hayek has a flair for the character in all phases of life."
7829,0,"Sluggish, tonally uneven."
7830,3,... standard weapons versus martial arts clichés without much new.
7831,2,"There's a safer way to get an Oscar nomination for best foreign film: Create a film about eccentric people who learn an unchallenging, life-affirming lesson while walking in an unfamiliar city with stunning architecture."
7833,3,Great dragons!
7834,1,"If George Romero had directed it, the protagonists would never have taken an hour to realize that one has to get shot in the head for a zombie to get shot."
7836,4,"The one-liners are crunch, situations fickle and chances of comedy are plentifully rewarded."
7837,0,The only thing that matters about Feardotcom is that the filmmakers and studios are brazen enough to attempt to dismiss this stinker as a scary movie.
7840,3,Thirteen conversations about one thing are clever and attentive and a gem.
7841,3,"The difference is ⁋ much of the time, I enjoyed Martha when I was thinking about the"
7843,3,I will.
7845,4,"A cleverly entertaining, skillfully acted and cleverly staged movie."
7846,1,"A sloppy slapstick throwback to long-lost fare such as The Ghost, and Mr. Chicken."
7848,3,"Although it lasts 163 minutes, ""Safe Conduct"" is anything but lazy."
7850,4,"empathetic written, very sensitively played"
7852,1,Almost unprecedented disturbance.
7853,3,"If you want to be dripped from the pumpkin, drop everything and run to Ichi."
7854,3,"The last kiss is heartbreaking and very funny, but it is really just a show."
7855,3,The premise of Jason X was silly but strangely credible.
7858,1,"To most casual filmmakers, it might be too boring."
7859,3,-LRB- A -RRB- smarter and funnier version of the old Police Academy movies.
7863,3,"A sense of real magic, perhaps."
7864,2,Only two fifths of a satisfying film experience.
7865,4,A round homage to a man whose accomplishments - and complexities - went far beyond the end zone.
7866,1,"Despite his sincere acting accomplishment, Signs is just another unoriginal reissue of the sci-fi film with a grim ending and a lot of bluster."
7867,3,... you can find here enjoyment that will warm the hearts of animation enthusiasts of all ages.
7868,3,"The story may seem ordinary, but the cast is an all-star reunion, which fans of Gosford Park will think is just another day of Brit cinema."
7869,1,A well-intentioned undertaking that is still burdened too much by the fact that the actor's emotional core competence is too burdened by his wilful sensibility to present itself in a certain degree of attainability.
7870,2,It is a well-acted film that simply doesn't cut it.
7871,1,"Lags behind on a seasick-out-of-water formula that goes nowhere and goes very, very slowly."
7873,0,"90 min A penalty of eardrum shots, screeching explosions and flaccid odd-couple sharpening."
7874,0,As tasty as the pork crackers last week.
7875,3,This real Hollywood fairytale is more exciting than the usual fantasies that Hollywood produces.
7876,2,"Like you will appreciate it, depends on the experience you have gathered and the associations you invite."
7878,2,It's deeply woven with the need to catalogue every bodily fluid gag from There's Something About Mary and devise a parallel clone gag.
7880,0,I'd rather watch a re-run of The Powerpuff Girls
7881,3,A cute romantic story with a special twist.
7882,4,A ravishing portrait of this man whose engaging manner and imperishable style made him a truly larger-than-life character.
7883,1,"Just as the lousy Tarantino imitation passed away, so followed the first lousy Guy Ritchie imitation."
7884,3,"It makes you feel against the humanity of an Ebola patient, without making you less psycho."
7885,2,"If you already like it, it will be again."
7887,3,Beautifully staged and convincingly acted.
7890,2,"This version of the Time Machine by H.G. Wells was directed by H.G. Wells ""great-grandson."
7891,2,Perhaps not since Nelson Eddy's Indian gesellschaften for Jeanette MacDonald has a movie been so brazen as a Canadian one without fear of exposing Americans to hatred or disinterest.
7892,0,"... unlikable, uninteresting, unfunny, and totally clumsy."
7893,2,Sandra Bullock's best dramatic performance today is -LRB- almost enough to lift -LRB- this -RRB- thrill kill cat and mouse... over this drawn motif of figures.
7894,4,"Everywhere Roger goes, theatre may be intolerable company, but it's worth spending some time with him."
7895,1,"The main story... is compelling enough, but it's hard to shrug off the anger from this chatty fish."
7898,1,It's not scary.
7901,1,"The film is a confusing mélange of sounds and styles, a moment romantic trivia and a chaotic drama."
7902,3,"Director Alfonso Cuaron manages to convince his audience lively and convincing with a carefully chosen cast and battles with speed - on occasion, with an omniscient spokesperson in the style of the New Wave of France."
7903,2,It comes with a mood such as the prechewing racial stereotype that has clearly crossed the corporate stand-up comedy mill.
7904,1,"Full Frontal, which launches nationally today, could almost be called a film satire, but it lacks the generous inclusiveness that is the defining, if disingenuous, character of the genre."
7905,0,"Even persistent voyeurs would have needed Job's patience to get through this endless, formless documentary about the swinging subculture."
7906,4,Exciting documentation.
7907,4,"The actress Gaï, with her unbelievSakamada legs and sweetly sweary 眠smile, is one of those wisecracks."
7908,3,"However, there is a lot of tongue-in-cheek in this movie, and no doubt the filmmaker is enjoying herself."
7909,2,"Senegal's fickle version of ""Carmen"" best suited to Djeinaba Diop Gai's stunning star lineup"
7910,4,-LRB- A -RRB- the devastatingly powerful and amazingly vivid Holocaust drama.
7911,3,"A highly watchable, giggling tale with a sweet touch."
7912,3,Better off after Foster leaves this small room.
7913,2,"To its credit, the film drew attention to its victims."
7918,3,"The three stories by writer and director Danny Verete together form a strong, reasonably satisfying framework."
7919,4,Provides a clear study of a friendship between women that is more complex and honest than anything that is portrayed in a Hollywood movie.
7920,3,"- LRB- Choo's face is - RRB- an astonishing slapstick instrument, a collection of live cups."
7921,1,"Despite some strong performances, never got beyond the level of a telanovela."
7922,0,A film version of a picture graded by numbers.
7923,1,You feel as though you've eaten a Reese without the peanut butter...
7924,0,-LRB- A -RRB- poorly executed comedy.
7925,3,"Mood, look and sound of the film match to a T."
7926,1,The script is exhausted and a few moments of delight overshadow bland material.
7930,3,Investigates with sympathy the seemingly irreconcilable situation between conservative Christian parents and their estranged gay and lesbian children.
7932,2,"In many ways it evokes the inexcusable of 1992, which likewise used the sparkling power of its actors to extract the threat from its sparse dialogue."
7935,4,It's no coincidence that The Accidental Spy is a solid action pic that returns the master of martial arts to his best.
7938,3,"Then the movie is overwhelmingly delicious to play the character Gai, so as to avoid the fate that would have befallen every other Carmen before her."
7939,2,Bad in such bizarre ways that this crazy confluence of sense and taste is almost worth watching.
7940,1,"Anemic, biased."
7946,0,"Neither much art theory - the special effects are ""German Expressionist,"" as the press magazine says - can be ridiculed by this."
7948,4,A weird drama set in the world of lingerie models and beard dancers in the Midwest just because it captured my interest just because it did not try.
7949,4,"Sweet sexy, funny and touching."
7950,1,Steven Soderbergh is no remake of Andrej Tarkowsky's Solaris but the distillation.
7951,1,A persistent theatrical feeling and a diffuse quality of storytelling erode the devastating expressiveness of complete forgetfulness as the simple film title illustrates.
7953,3,"There's no question that this is really an outstanding work from a well-known director, one who actually has something new to say about how in the flip-flops of courtship you often join in with stirring applause when you appear."
7955,3,"Even if Broomfield's film fails to recognize the impact of these tragic deaths on hip-hop culture, it does manage to paint a haunting picture of the failures of our legal system."
7956,4,"The direction and costumes are ravishing and lovingly structured, and Kurys's direction is smart and compelling."
7958,0,How clumsy is it to serve Sara?
7959,1,Chilling comedy.
7960,3,It is not a gimmick to stand up and cheer; it is a thing where we sit down and think about it all.
7961,3,I was captivated by nearly the first two-thirds of Martin Scorsese's 168-minute film Gangs of New York.
7962,1,Originality is sorely lacking.
7963,1,"The Merchant-Ivory team continues to systematically destroy everything we loved so much about cinema, only to separate now to cause even more damage."
7964,1,Suffers from a flat script and low budget.
7965,3,You can be healthy and subversive at the same time.
7968,2,"First a thunderous ride, quiet cadences of pure finesse rare, their lack diluting the effect of an otherwise respectable act."
7969,1,You might hate it for the same reason.
7970,4,Cool gizmos and creatures keep it fresh.
7971,1,"... while the humorous aspects of ""Jason X"" were much more entertaining than I expected, everything else about the films."
7972,4,"Stevens has a flair for dialogue comedy, the film works well without surprising elements, and the large cast is solid."
7975,1,"Pleasant, but no more than recycled jock piffle."
7977,3,"Although the material is low, the film is better than you may think."
7978,2,"Jarecki and Gibney find enough material to question Kissinger's past and explain how the diplomat's modified version of statesmanship may have cost thousands, and possibly millions, of lives."
7981,4,"Director Roger Mitchell moves with purposeful finesse from likeable, relatively light-weight fare like Notting Hill to commercial fare with a real thematic accent."
7988,3,"If it's not hormonal melodrama, ""Real Women Have Curves"" is a sweet, honest and enjoyable comedy-drama about a young woman who wants many things in life but is frightened she might become a mother before she fulfils her dream."
7989,3,"A touching, sophisticated film, which almost seems documentary because it captures an Italian immigrant family that is about to undergo enormous changes."
7990,3,"Overall, the life of the campaign trail press is an interesting look, especially when it's not so much about which candidate they're forced to backtrack on."
7992,3,"A quiet, unsettling triumph."
7993,2,"Brown's story is, as so often before it, biting prose, but a stumbling block from a film."
7995,3,It is an amusing indictment of Jagger's own profession.
7996,3,"The conditions are realistic, although not always fair."
7997,4,A chance to see three great actors turn an invisible chase film into an emotionally satisfying exploration of the human need to be and belong to someone.
7998,4,The film mountain has the courage of its convictions and the superb performances on its side.
7999,0,Nothing about this film works.
8000,1,"For all his brilliant details, Dragon loses his fire at the halfway line, almost echoing in his chilling conclusion."
8001,0,"As the film wore on, I thought I heard a mysterious voice and felt powerfully drawn into the Light - the light of the exit sign."
8002,3,Light but appealing.
8004,1,"If you saw Benigni Pinocchio in a public park, you would grab his kids and run and probably call the police."
8008,1,There needs to be a more dignified way of depicting the devastation of this disease.
8009,3,"It is a well-worth reading documentary, whether or not you have fallen in love with rap, even though it may provide some answers in the credits."
8010,0,It is always disappointing when a documentary doesn't live up to its chosen theme and doesn't provide new insights.
8011,1,"Dogtown is hollow, smug and - worst of all - boring."
8012,3,This is surely a film that has become profane and politically charged music to the ears of Cho's fans.
8013,3,"But though Robert Evans, now 72, has had a stroke, he has at least one more story to tell: his."
8015,3,"If you read and / or love poetry, you should take a closer look."
8017,3,It allows every character to face their problems openly and honestly.
8020,0,"Despite the plot being better focused than the incomprehensible Anne Rice novel based on it, Queen Of The Damned is a pointless meandering celebration of the vampire who's so pathetically miserable."
8021,3,"While there is little concern about the Elizabethan administration (LRB), and genuine frustration among those who know about Rubbo's sitzer-Down tactic, Much Ado About Something is a consensual affair."
8022,0,The bears are even worse տ than I have ever imagined.
8023,3,"He constantly questions the perception of guilt and innocence, of good and evil and asks whether a noble end can justify evil means."
8024,4,A pleasant piece of escapist entertainment.
8025,2,"Swimfan, like Fatal Attraction, eventually goes overboard with a melancholic twist, replacing a swimming pool with a bathtub."
8026,1,"An ambitious, guiltless melodrama crippled by a poor cast."
8027,2,Fans of the show shouldn't see that as a disadvantage.
8028,3,"Besides the crucifixes, Barbershop gets its first piece of timeless acting, in which people actually talk to each other."
8030,3,Cremaster 3 is a tough swallow pill and a small wonder of self-expression.
8031,0,It looks more like a travel agency video of people jumping on topless bikers and rolling in mud than a rewarding view of flashing lights in communities.
8032,3,Cletis is playful but sophisticated and relies on a patient viewer to succeed.
8033,3,"Although the subject may have been too close to recent national events, the film does go down well, largely because of its superior cast."
8035,4,"The cast is phenomenal, especially the women."
8036,1,The only funny thing about the movie is playing the obvious game.
8039,3,"The producer, John Penotti, surveyed high school students... and came back with the astonishing revelation ""they wanted to see something that they didn't like."""
8043,4,"It's an interesting film! """""
8044,4,"Gay or straight: ""Kissing Jessica Stein"" is one of the greatest date movies in years."
8045,0,"There is not Nichts moment when one can get up from his seat and believe it or not, Jason even takes a smell of special effects in his own movie."
8046,2,"As director DanGastgeber Kouyate of Burkina Faso points out, Sia lacks the visual sense."
8049,4,"Twenty years since its first theatrical release, E.T. remains the most wondrous of all Hollywood fantasies - the crowning moment in Steven Spielberg's misunderstood career."
8050,0,"A so-called ""made for TV"" product that disguises itself as a real movie."
