Id,Category,Sentence
0,3,"-LRB- The film -RRB- negotiates the topic of relationships in such an uncomplicated, emotionally honest manner that at the end it's impossible to tell whether the movie was largely pessimistic phrase or whether it softened a bit of hope."
1,2,"In a lavish, intoxicatingly distasteful fashion."
2,4,It's also wonderfully played.
3,1,But like in silence the film gets under your skin.
4,2,They did it with an innocent but burning conviction that our Hollywood has all but lost.
5,2,Director David Jacobson tells Dahmer that the killer should never shed his victims.
6,4,"Taken together, Cletis Tout is a prize-winning comedy that continually inspires the imagination and tickles the laughing muscles of the lem pugilist."
7,1,The film is far too impressed by its own serious insights to apportion much entertainment value.
8,1,< br > -LRB _ Hopkins -RRB- did not launch by phone.
9,4,Adorable fun.
10,1,Too bland and shabby to be truly prudish.
11,4,Ozpetek's efforts are in the scope and shape of one of the most well-executed television shows.
12,1,"As the Mediterranean sparkles, ""Moved"" sets."
13,3,Laughter and insight into one of the hardest times a child can go through.
14,3,"Uneven, but very amusing."
15,4,"Compared with the usual bleaker festival entries, Davis' highly personal romantic comedy is a stern, intelligent air that lifts off from the rest, even if the paintings in themselves seem somewhat problematic."
16,3,The sheer joy and pride which they felt in their work - and in each other - permeates each of their frames.
17,2,"This film seems motivated more by the desire to compare mortar chalkboards to the Society of Dead Poets olympics and Good Will Hunting, than by its own story."
18,1,"He doesn't really know the protagonists and doesn't care about them, he often uses them as a marker for a bunch of predetermined events."
19,0,"Dissociate yourself by throwing out so many red herrings, so many false fears that no one really speaks up."
20,4,record Schnitzler is proving an accomplished pacemaker and stylist on his US debut.
21,2,"""Home Movie"" is the film-mature equivalent of a lovingly illustrated sheet."
22,3,"It is anything but a fuming piece, and the characters are multilayered, laden with baggage and interwoven with tragic undertones."
23,1,These characters are getting tired.
24,3,"George Lucas is back as a visionary, with a story full of nuances and dimensions of character."
25,3,"It is the film about growing up that we don't see often enough: realistic, urgent, not coated in even the slightest sugar."
26,3,"My Big Fat Greek Wedding is a rare beast known as the ""perfect family film"" to name a few, because it's all about family photos."
27,1,Overloaded with complicated conspiracy theories and banal dialogues
28,4,This deeply moving melodrama is made memorable by excellent performances from Jacqueline Bisset and Martha Plimpton.
29,4,The real-time film never loses its ability to shock and surprise.
30,2,"No doubt Epps will score a goal or two, but when he falls to the ground about 50 feet down, he knows that the funniest moment is just around the corner."
31,3,-LRB- A -RRB- satisfactory node
32,2,The vampire epic succeeds as an eerie action-packed trash of the highest quality.
33,0,"By that standard, he has failed."
34,3,The 31-year-old stars as the hugely popular Vin Diesel who is sure to put plenty of cash on the line.
35,3,An unobtrusive love affair that strikes a very sonorous chord.
36,4,This is the best Star Trek movie in a long time.
37,3,"Most memorable of all is that it's made on digital video, the tiny camera of which allows Shafer to navigate both small islands and large islands with considerable dexterity."
38,1,Fails so fundamentally on any conventional level it reaches some sort of digressive size.
39,4,It's the best comedy film I've seen since Cho's 2000 comedy I'm the One That I Want.
40,3,"""Return to Second Time Land"" may be Disney's latest shameless attempt to make dough at the behest of baby boomer families, but it's not half bad."
41,1,I am more likely to scratch my head than hide under my seat.
42,3,The performances are consistently good.
43,1,"A sharper, cleaner script would have secured that before it went to the camera."
44,1,What is really wrong with this order!
45,2,Striking and inelegant in her so-called message film.
46,0,"Humourless, confident and accurate, without any hint of intelligence or inventiveness."
47,3,"An interplay of children's entertainment, complex wit and symbolic graphic design."
48,1,"With three hours and very little presentation of the show or character development, enough space for editing and a significantly shorter editing would certainly have lost nothing of the cultural intrigue with its disciplined and focused narrative style."
49,4,"The plots are knitted together, the beautiful floating aerial images are breathtaking and the whole experience is impressive."
50,0,The whole film needs a fragrance bath.
51,1,"The film veers between sentimentality and tolerant, life-affirming moments straight from a mobile phone commercial."
52,2,LRB- A rare film that causes us to reevaluate and evaluate the basis of our lives in a world of meaningless activities.
53,2,"Has a delightful style of music to dance to, but its energy remains distinctive from the wit, humour and biting dialogue of the original."
54,2,Wallace conducts with such patronising reverence it creates a poignant stirring of the stomach.
55,4,You will probably love it.
56,1,More tiring than anything.
57,0,Something seems to have went wrong with the translation this time.
58,4,Sexy and romantic.
59,3,"In Lieutenant Maid in Manhattan, Jennifer Lopez's most aggressive and frank attempt to blow movie projects away, the diva has surrounded herself by the company of stern A-listers."
60,0,"Then, in the most predictable of plot sequences, you swear you'll have seen it all, even if you're never within a mile of the Highest Court."
61,3,"Birthday Girl revolves around Chaplin and Kidman, who are able to develop a certain movie-star charisma when they need it, as it does not just to sell the love story, but also to negotiate the film's darker twists and turns."
62,1,In light of Baird's earlier film editing the film is a bit of a bumpy ride.
63,3,"In the first five minutes, there is talk of ""to the end of the year""!"
64,0,This film mess is quite a travesty of a transvestite comedy.
65,2,It's exactly what you'd expect.
66,1,"-LRB - Stevens is intrigued by - RRB- making an important film about human infidelity and chance, throwing a kitchen sink into a story that is already loaded with plot details."
67,0,And it's increasingly difficult to believe anyone in their right mind would have been doing that.
68,2,"Although it never develops its full potential as a film, it nonetheless provides a wealth of insights into femininity and the timeless danger of suppressing emotion."
69,1,"The filmmakers play the grand figures in New York and L.A. to this end, and for that reason they ridiculed the types of people they don't understand, or understand better in centres of power."
70,2,This harrowing journey to the afterlife convincingly captures the chaotic madness and personal tragedies that all too often exist when property-hatred spreads uncontrollably.
71,1,You leave the room as if you had endured a long workout without your pulse ever racing.
72,2,"The smash 'em - up, crash' em - up, shoot 'em - up end comes from nowhere, bringing chaos into a state of tension."
73,3,I still love Moonlight Mile. Better judgement be damned.
74,3,has more than its fair share of cheeky hilarity.
75,4,"Like a skillful fisherman, the director reels in the audience with his last act, because its moving effect leaves us completely intoxicated."
76,2,The camera turns!
77,1,"Cassavetes thinks he's doing Dog Day Afternoon for a good cause, but everything he talks about is reduced to a strident and didactic caricature."
78,0,"As aimless as an old pickup truck that gets completely out of hand on a long piece of black ice, you feel like you're four hours away in two hours."
79,2,The same person in both hats.
80,1,"The film never rises above a conventional, two-dimensional story"
81,1,"< k > Freaky Friday, '' it's not."
82,0,Skip the hubbub and focus on picking your nose as you'll no doubt be using the latter experience to your advantage.
83,2,"Like so many silent movies, newsreels and the like, Dekasia changed the world."
84,0,"This awkward, cliched and clunky romantic comedy attracts controversy for no better reason than, according to its script, that it squanderes the charms of porn stars Hugh Grant and Sandra Bullock."
85,3,Scott Baio is shooting his sexy work on indie projects.
86,3,"Wiseman is patient and uncompromising, using his camera to watch and document the lives of women torn apart by a legacy of abuse."
87,3,"An unusual dry, even analytic approach to material usually played for maximum moisture."
88,4,"A lively, colorful semimusical rendition."
89,3,Your kids will be busy for 72 minutes.
90,3,A sensitive and intelligent first feature film by Anne-Sophie Birot.
91,3,The obnoxious title character lends the documentary the drama it deserves.
92,3,"A meticulously assembled, annoyingly good film, ticking off all sorts of stages of Kahlo's life with the dutiful precision of a tax adviser."
93,0,"The film almost completely lacks the tension, surprise and consistent emotional conviction."
94,3,"A mostly believable, refreshingly intimate and quietly inspiring small sports drama."
95,2,"The film is explosive, but some of these sticks are wet."
96,2,"On a certain basic level, Blue Crush keeps what it promises, but just isn't good enough to recommend it."
97,2,"When you revive a dead person, hard copy should come out, right?!"
98,3,"It's an edgy, sentimental dramedy that satisfies the way comfort food often satisfies."
99,1,"The obscurantiest and funniest excuse for a movie, as you might imagine."
100,4,Diggs and Lathan are one of the main reasons Brown Sugar is so sweet and sexy.
101,4,... a delicious crime drama on par with the flattest Mamet.
102,3,"Derrida is almost useless as an introduction to man's theories and influences; as a portrait of the artist as an endlessly inquisitive old age, it is already of great value."
103,2,"Venezuelans say things like ""si"" or ""pro pro pro plus"" when they talk to the Americans."
104,2,It is the kind of trick that the Academy loves: a strong political message stuffed into an otherwise mediocre film.
105,4,One of the best and most entertaining performances of the -LRB-career.
106,2,"It may sound like a mere illness movie, but A Song For Martin is all the more captivating with the performances of the real husbands Seldahl and Wollter."
107,3,A quietly moving look back at what he achieved in 1979.
108,4,"A shimmering and beautiful coming-of-age portrait, shot in artfully watery blues, greens and browns."
109,3,"By turns hilarious and sad, pushy and soulful, devastating and joyful."
110,1,It's a pity this sympathetic film is not more finished.
111,2,"None of this has the regularity or classical familiarity of Bond, but much of it is good for laughter."
112,3,"A breathtakingly strange film, which is profoundly concerned with morality, but which refuses to tighten its grip on viewers."
113,4,Admirers of director Abel Ferrara are relieved that his latest feature R Xmas marks a modest but encouraging return to form.
114,0,"Once the expectation of a laugh has been betrayed by obscenity, even the funniest idea is no longer funny."
115,0,... this is not even a film we can enjoy as mild escapism; it's a film that challenges fear and frustration at an uneven level.
116,1,"Proresolve turns out to be a lovely little thing, which, unfortunately, is also a little too enamored with its own cuteness."
117,3,"The filmmakers attempt to strike a balance between trenchant, often succinct, satire and undisguised beauty, with results that are sometimes mesmerizing, sometimes stunning, often and unexpectedly touching."
118,1,"The screenplay covers grand, drasaucy themes in a bland and superficial way, offering no insight into why bad things happen to bad people, for example."
119,1,"Sometimes a film emerges that is so foolishly stupid, so horrendously serious, that you get dizzy when you see it."
120,3,"Holofceners ""film doesn't zwanzig at all - but makes it as clear that you don't have a mayfly and the cast's commitment is so prehensible that you don't retreat too often."
121,4,Outstanding shot and staged by Mendes with a range of stirring set pieces rarely seen by mainstream audiences.
122,2,"In trying to be bold and original, it only comes across occasionally satirical and never fresh."
123,3,The giggling about absurdities and contradictions are part of the fun.
124,3,Magical L / RB- and Original Term of MCA of Spirited Away (Spirited Away) Ace Hayao Miyazaki has survived unchanged in BV's newly-soundtrack.
125,4,"An emotional documentary about the Israeli / Palestinian conflict, as it unfolds through the eyes of a number of children who are curious about one another against all expectations."
126,3,Makes one thing abundantly clear.
127,1,"Parents beware, this is downright penal for a film."
128,0,"... the story is wide-ranging, illogical and downright stupid."
129,2,It is difficult for a long-time admirer of his work not to feel the air of invincibility and to overlook its disadvantages.
130,0,But that would only put you to sleep.
131,1,"It has more in common with fireworks than a movie, which usually has characters and a plot."
132,1,"Adrift, Bentley and Hudson stare rather sniffily, while Ledger vainly attempts to prove that the movie star's intensity can overcome bad hair styling."
133,1,"We Anhänger see Matteis undermining himself here as nothing more than a compact tightrope of brooding characters, overcome by the hand of stick character camp - a sleepy drama infatuated by his own pretentious self-examination."
134,2,"The same song, second verse, could have been better, but it could have been worse."
135,1,"Fincher has no obvious delight in making movies, and he gives none to audiences."
136,3,"He has an amazing voice - LRB- except for Love Hewitt-RRBD, a lot of interesting racial tension and a story I haven't seen since ""Pete ざ."""
137,4,Brutally honest and told with humour and haunting empathy which echoes her message.
138,2,"A love story of a different kind - a dark, upsetting, painful but gripping show."
139,3,Roman Polanski's autobiographical gesture of redemption is better than Shindler's List - it's more than a Holocaust film.
140,2,Has the potential for a better performance than what Bailly is delivering
141,3,"World Travelers may not tell you where to go for a new trip or to any special place, but it is certainly an honorable attempt to make a difference."
142,4,"Kenyan pleasure, a lovely, witty, highly stirring romantic comedy with leading jazz music... Grant and Oxwork make it seem they're having so much fun."
143,2,The film has a childlike quality.
144,1,"They are the unnamed and easily replaceable forces which serve as the horror, which the heroes in the horror movies try to avoid."
145,3,Scorsese's courage and integrity in pursuing this vision should not be underestimated.
146,2,"Oh, what the hell."
147,2,"Boy, oh boy, howling."
148,4,"An unsettling, memorable cinematic experience that makes his predecessors proud."
149,2,Veterans of the dating wars will only smile wearily at the horror versions of the movie's everyday Sex in the City mishap.
150,1,"These metaphors are provocative, but too often, the viewer is left baffled by the mechanics of the presentation."
151,3,"It's a diverting film, and the effects, which grew to the size of a downtown hotel, will almost take you into outer space."
152,0,"It's a laughable - or rather, an inexcusable - excuse for making a film."
153,3,"Jacquot has filmed the opera as intended in Court 27 libretto, and captured the drama and poetry of opera in its best sense."
154,3,"Spirit aquarium: Colt of the Cimarron, a good old adventure for kids, is a winner."
155,1,"A Bauhaus film, where the story amidst the whirlwind of colours and inexplicable events is almost a side-effect."
156,4,"So those who recognise a shoe of avant-garde humour should take pleasure in the film 's lunatic, joyful tone."
157,4,"Perfectly placed between comedy and tragedy, hope and despair, About Schmidt is closer than many of us to their lifestyles - somewhere between consumerism and a persistent demand for otherness."
158,3,"Far From Heaven is a marvellous conceptual masterpiece, but it's also a gripping drama."
159,3,"Functs as an exposing perspective on the common process and simultaneously as a timely, winking profile of the sound circus in the record industry in the current climate of mergers and personnel reductions."
160,3,"Youth are appropriately served by the second mix of slapstick and black, even if the more lascivious mind figures might be disappointed at the relative modesty of a film showing topless."
161,3,A delicious appetizer that makes you want more.
162,2,"So obsessed is the Sundance Film Festival that every January, fans and producers descend upon Utah to see ""The Next Great Thing."""
163,4,"Like lipstick shadings, they make for a great story with lots of lashes."
164,1,"The film has its -LRB-, its -RRB- moments, but these are rare and far away."
165,4,"A sensitive, cultivated treatment of Greene's work, but also remarkably faithful."
166,1,Trying to write the story upside down in the hip hop indie snipes is enough to weigh on the brain - yet the impact is negligible.
167,0,"-LRB- Less a film than -RRB- a disgusting, fragrant thing... so bewitched in almost every facet of the production that you seek to embarrass yourself."
168,0,Dark boring sci-fi comedy.
169,1,"Just because A Walk to Remember is clever enough to activate girlish lavatories, that doesn't mean danach it's good enough for our girls."
170,1,"If I want music, I buy the soundtrack."
171,2,You could put him anywhere on a coffee table.
172,3,Reno itself has jumped the shark to the top of the film charts.
173,0,I'm not sure what will take longer to heal: the wound on Johnny Knoxville's stomach from a riot control project or my own tortured psyche.
174,2,"Apart from playing, or as an original dark joke, one wonders what anyone saw in the movie that made it happen."
175,1,The romance between the leads isn't as convincing or even believable as it should be.
176,3,Succeeds without a huge story to inspire.
177,4,Easy to see and - above all - listen to.
178,0,He urgently attempted and unsuccessfully to unite at least three boring plots into a good one.
179,3,That's why Sex and the City is so enticing.
180,2,"Towards the end of Allen's execution the documentary vividly portrays Vincent's friendship with the ever-weary investigator of justice, David Presson."
181,2,Or a dog winks.
182,1,This 100-minute film contains only about 25 minutes of suitable material.
183,3,"Gooding is the energetic frontman, and it's hard to sustain his enthusiasm, even when the filmmakers can't think of anything original, such as slapstick sequences."
184,2,... a preachy parable stylized with a touch of John Woo Bullet ballet.
185,2,"Massoud's story, Aleppo, is an epic but a tragedy, a testimony by a determined, humane fighter who was a prisoner - and victim - of history at the same time."
186,2,It does not seem to reach the heart of the whole story.
187,1,This could be the first cartoon ever to look like it's being shown on a screen at a sports bar.
188,2,"Shadyac, who is among the band of the reprobate committing an act of God, downplays every ghost trick from The Sixth Sense to The Mothman."
189,0,The movie really has it in it.
190,1,You may have to look further than your own caddyshack.
191,3,So hilarious you sturm wont notice this: It's quite a straightforward remake of Hollywood comedies like The Father of the Bride.
192,4,"Smart, cheeky interpretation of the Oscar Wilde play."
193,0,"It may well happen that, before I recognize this piece of crap, people have discovered the secrets of time travel, dismissed it as a boring thing while enjoying it."
194,0,It's almost invisible.
195,0,"Given that practically no one has to go to the theatre for it, the project has to have been packed off to the tube."
196,3,"Screenwriter / director Burr Steers emphasizes the Q in Quirky, with mixed results."
197,1,But no.
198,3,That is a vision.
199,3,"The real star of this film is the music, like the songs which are very good to film and it is really well directed."
200,1,A potentially good comic-book series and an excellent cast are terribly wasted.
201,2,Maelstrom is a deliberately irregular mixture of style elements.
202,1,"The movie has an excellent cast < a href > A'list and a few strong supporting characters, but it's difficult to love the story, like its main character, Vivi."
203,2,A bunch of typical perpetual end-of-a-thing stuff
204,4,It's the sort of creepy-scary thriller where you get stuck in the back corner of the screen sometimes because your nerves just don't work.
205,2,"Has all the right elements, but fails completely."
206,0,It is constantly slipping away from its country of origin.
207,2,"He tells his story flat out, leaving the impression that you needed to get more out of him than you did."
208,3,"Skin Of Man has some cheap shocks coming from its risky childhood theatre, but it also heaps itself upon the primordial fears of young people trying to come to terms with the mysterious and brutish nature of adult life."
209,1,"Conveys an eye-catching nuance to the area of art, but one that quickly overforces his limited welcome culture."
210,4,"As an actress, Madonna is among the best singers in the world."
211,1,"At a time when we had to learn the great complexity of international terrorism, collateral damage paints an absurdly simplistic picture."
212,0,"""The Adventures of Pluto Nash"" is the stinker par excellence."
213,2,Go.
214,3,"a bilingual charmer, just like the woman who inspired her"
215,4,A fascinating case study about the liberation of flower power - and the price paid for it.
216,0,"Instead of engaging in laugh-outs, Lawrence unleashes his trademark misogyny, erm, comedy, like a human volcano or an overflowing garbage dump."
217,3,"A vivid, sometimes surreal look at the secrets of human behaviour."
218,2,"The results, if not memorable, are interesting at least."
219,2,Please.
220,0,The performers try their hand but get away too amateurish and clumsy.
221,0,Like so many biographical melodramas this one suffers from the comfort that comes from the attachment to the messiness of reality.
222,1,The humour in I Spy is so anaemic.
223,4,One of the year's most bizarre and unpredictable character pieces.
224,0,A pathetic movie which aims to be sincere and just plain worse.
225,1,As original and insightful as the last episode of Behind the Music.
226,0,... if you order that you spend the last 20 minutes looking at your watch and waiting for Frida to die.
227,2,This English language... does justice to Miyazaki's teeming and often disturbing landscape and the conflicted complexity of his subjects.
228,3,"A quiet family drama, with some romance and a dash of darkness."
229,3,"Old-fashioned, but perfectly satisfying entertainment."
230,0,Absurdities and clichés accumulate like linceremony in the navel of a fat man.
231,1,"Sarah appears to be feeling psychotic rather than romantic, and nothing in the movie convinces that a woman's broken heart was faster than all the loss."
232,2,"Since Eight Legs Freaks pays homage to you, Tarantula and other budget B-movie thrillers of the 1950s and 1960s, the flick is a silly LRB hype and hell, but not exactly the RRB hum."
233,0,"In order to understand better why it was not related to me I needed a different view, and I would not read this expression out again... This alone is sufficient for a comment."
234,4,"A colourful, vivid introduction to a universal human impulse, richly photographed and beautifully captured."
235,0,With the most kitschy monsters on this side of a horror story there is little chance it will generate a quick sleep than feeling fear.
236,2,"It's hard not to get serious about the dramatic crisis in the film, but Huppert's explosive game does make for a riveting cinematic experience."
237,0,"When you have 100 minutes, you're waiting in vain for a movie."
238,3,"Good rather than great, but Freeman and Judd make it work."
239,3,"Takashi Miike keeps up the tempo: Ichi, the killer"
240,3,"Though the programme goes further than just that, anyone who has seen The Hunger or Cat People will see little of the novelty here, but with a mouth-watering performance from Vincent Gall民️, the story of cannibalistic greed rises above the ordinary."
241,1,"The whole film moves from one scene to the other, but in the end it maintains its formula - a waste of De Niro, McDormand and the other good actors in the cast."
242,3,Meyjes' provocative movie can be described as an example of a lack of direction by evil.
243,1,Credibility was not one of the film's virtues.
244,2,The only way to beat that is to not go far enough with the Shakespearean parallels.
245,3,Miller has developed a fascinating tale of maternal instincts and misdirected feelings.
246,1,The length of the broadcast... overwhelms the concept of the broadcast.
247,4,"We admire this film for its harsh objectivity, its refusal to seek our tears, our sympathy."
248,3,This is a sharp movie about otherwise stinky subjects.
249,0,"A muffled, drowsy exercise in arrogance, the rest of which is often broken by outbursts of violence and noise."
250,4,"If you're a fan of the series, you'll enjoy it and probably want to watch it twice."
251,1,... silly humbug...
252,1,The setting is more interesting than any of the character dramas in which satisfying conclusions are never reached.
