Id,Category,Sentence
4919,1,All you can see is that an intelligent person is not necessarily an admirable storyteller.
4920,3,"Not a film for the faint-hearted or the conservative, but for all of us - especially the lovers of San Francisco - it is a spirited film to watch by all means necessary."
4921,0,The film is a dud.
4924,3,There is a lot of tooth in Roger Dodger.
4928,1,"Whether it's an art that imitates life or an art that imitates life, it's all about an unfortunate situation."
4929,3,Unexpected and often contradictory truths emerge.
4930,2,"Interesting, but not mandatory."
4931,3,Anyone who grew up on Scooby will love this movie.
4933,3,"-LRB- Here is a bit of heart, like you'd expect from the directors of The Little Mermaid and Aladdin."
4934,0,"Even if the tantalizing sight of many nascent young actors in a film about campus depravity had not faded amid purposeful, tiresome ugliness, that would be tiresome of Avary failing to write a novel with even a hint of dramatic aders."
4935,3,"Like its many predecessors, this Halloween is an exhilarating celebration."
4936,1,"Jackson saunters through the mess a bit sheepishly, grinning smugly. Inexplicably, he wears a kilt and carries a bag of golf clubs over one shoulder."
4937,2,allusions to other films.
4938,0,"Poor editing, poor blues and ultra-kitschy dialogue underline the radical action."
4939,2,"I'd rather imagine it as ""budget pie."" """
4940,2,"If you aren't completely committed to the idea of cinema as a non-profit therapy 穴, quitting will come up with disorienting powers."
4941,3,"Often messy and frustrating, but very appealing at its best, it is just like life itself."
4942,1,"In reality, she has the full nucleus of a porn series - LRB - but none of the sheer lust - RRB."
4943,1,Grant is not Cary and Bullock is not Katherine.
4944,1,"Nijinsky says, ""I know how to suffer,"" and when you see this film, you know that."
4949,1,The story has some bad bits but the ending and some sub-plot are a bit tired.
4950,3,"It's not too fancy, not too filling, not too fluffy but definitely tasty and sweet."
4951,0,Ill-informed and confusing from the start.
4952,4,"Elegant and eloquent -SRB- meditation -SRB- on death and those least tangible, love."
4954,4,"If the real story is truly inspiring, the movie moves us too."
4955,0,"It's supposed to be a crazed screwball comedy, but the worst part of this story is how so many talented people have been persuaded to waste their time."
4956,2,Red dragon appreciates the silence of lambs.
4957,1,"Until his last minute, this is a sensitive study of two crisis families - and of two girls whose friendship is severely tested by bad luck and their own immaturity."
4958,2,"A culpable pleasure at best, which is not worth seeing unless you wish to laugh about it."
4959,3,"There's something frightening about an artist of 90s going to the trouble of sharing his impressions of life and loss, of time and art."
4960,0,It is a pity that Nelson's LRB performance has not matched his ambition.
4961,1,"It irritates and saddens me that Martin Lawrence's latest vehicle could obnoxiously explode in 2500 displays, while something of Bubba Ho-Tep's obviously obvious quality could be slumbering on a shelf somewhere."
4962,3,Has moments - and almost as many subplots.
4963,4,"The titles are one of the most fascinating film experiences of the year, the pictures speak for themselves and force us to think again about what a film can be."
4964,1,Think of the movie as a celluloid litmus test on your date's mental and emotional progeny and a giant step backwards for a director I admire.
4966,4,The engrossing performances from this incredibly varied cast make Love a real pleasure month.
4968,2,"A dark mixture of nutty romance, dark satire and whodunit."
4969,2,Adam Sandler!
4971,2,The movie producer cleaned one out.
4974,3,"A bit melodramatic, but with enough hope to keep you busy."
4975,1,The castle... doesn't so much care about cultural and political issues as its quirky characters.
4976,1,Zigzag might have been richer and more watchful if he were less closely spaced.
4977,1,A puzzle whose pieces do not fit together.
4978,1,Unfortunately < unk > Garth didn't do as well as < unk > Wayne. '
4979,4,A wild trip with eight Venice Beach boarders who won the Audience Award for Documentary Film at the Sundance Film Festival.
4980,1,The answer is very clear based on the evidence available: not easy and ultimately not good enough.
4982,3,"ProJahrhundert is an unmatched world war drama that still doesn't quite hide its feats, but at least it draws attention to a problem that Hollywood has ignored for too long."
4983,0,"A sleazy, incoherent mess... a dirty blather during David Cronenberg's brilliant ""Videodrome."""
4984,0,A mechanical action-comedy with the apparent purpose of marketing the charismatic Jackie Chan to younger audiences.
4986,3,"Extremely touching... an obviously manipulative film, but one that turns out to be more powerful than heartbreaking."
4987,4,Think of it as perfection.
4988,0,"In the editing room is somewhere... footage that No Such Thing might have packed into biting, ironic cultural satire rather than a frustrating misfire."
4990,3,"For decades, we marveled at Disney's depiction of water, snow, flames and shadows in a hand-drawn animated world."
4991,3,"Despite the elaborate formalism and intellectual austerity the film - with its shifting endangers, political intrigues and its calamities - keeps at arm's length."
4992,0,Sometimes it actually hurts to watch.
4994,3,"Just something for Friday night fans, for critics."
4995,1,This is the kind of film where people who've never chosen a castle are making it easy and in a few weeks will become real fighters.
4996,3,"The importance of seriousness, so full of wit that the film feels like a reading of Bartlett's familiar quotes"
4997,2,At his best - LRB- and it has some very funny sequences - RRB- Looking for Leonard reminds one how weirdly subversive silence can be.
4998,0,All this is superficial psychodrama.
5000,1,"Quirky, shallow, trying to get away with a sense of humour that's not as bold as John Knight's glory days at Three's Company."
5001,4,"This is an empathetic and moving portrait of an American, LRB- and an American, RRB- who is always looking for something out of reach."
5002,0,"The film's growing incoherence gives a new meaning to the phrase ""fatal script flaws."""
5003,4,Much more comfortable than its predecessor.
5004,2,"Not everything in the film is working, not even the slightly more comfort-hungry ending."
5005,1,"Linklater fans or discerning types who want to appear avant-garde will submit to the project... """
5006,2,"I don't think Analyze That is as funny or entertaining as Analyze This, but it is a respectable sequel."
5007,4,Forgive any thought that the German film industry can't make wonderful comedy about food.
5009,1,This Farrelly brothers rip-off is way too creepy - and within a relatively short space of time.
5010,3,A clever little indie.
5011,1,"Full of flatulent jokes and mild sexual references, Kung Pow!"
5013,4,"In between, De Niro and Murphy make Showtime the spiciest, most hilarious of the current box office season."
5015,3,... works in high altitudes and is certainly worth seeing.
5017,3,A fast-paced yet thrilling Argentinian thriller about the downside of the game.
5018,1,How long is the movie?
5019,1,Just a kiss is pure waste.
5020,1,It just isn't as funny as it should be.
5021,1,"To work as flat entertainment, and not remotely incisive enough to be called drama, Monsoon Wedding serves to whet the appetite for Bollywood movies."
5022,1,"Britney Spears' Phonowitz is nothing compared to the driven, shaggy screenplay and listless direction."
5023,2,The film that Franz Kafka would have made.
5025,0,LRB's MacDowell ventures beyond her own abilities many times and shows just how poorly an actress is.
5026,1,First-time John McKay can never get them back on track.
5027,1,"The film, like Jimmy's routines, could bear a few laughs."
5028,3,"Miller tells this very convincing story without screaming or noises, while craftily extracting tension in silence."
5030,0,"The actors improvise and shout their way aimlessly around the movie, lacking the blinding dark humor that such ideas require on the stage."
5031,0,The rest of the movie... is dudsville.
5033,1,A by turns rough and quirky ethnic sitcom... you should be wise to say your remorse.
5034,1,"Ice Cube is not fully mature yet, but Friday after next it's distribution very thinly."
5035,1,A domestic melodrama with weak dialogue and biopic clichés.
5038,2,"The photographer's show-don't-tell attitude is admirable, but it can turn him into a problematic documentary."
5039,2,"It is honest to a fault, but unfortunately not very compelling or particularly funny."
5040,3,That story still seems relevant and relevant.
5041,0,You can't believe someone would actually buy this stuff.
5042,4,A truly moving and wise unsentimental drama.
5043,4,A film of captivating power and sadness.
5044,0,"Endless desolation, not to mention boring."
5046,3,Art demands live broadcasting.
5048,3,"If villainous vampires are your cup of blood, Blade 2 is definitely the better record."
5049,2,Necdotes of New Yorkers consumed by money and their serial loveless hooks.
5050,3,"Formulaic, but funny."
5051,0,There is nothing funny in this joke - and has been told countless times - before the film.
5052,2,"-LRB- Screenwriter -RRB- Pimental took the Farrelly Brothers comedy and feminized it, but it's a rather scant imitation."
5053,1,"The film fails to capture the tension, the eloquence and the spiritual challenge which have made the original tales of the New Testament so compelling over twenty centuries."
5054,2,"Entertaining, but like fish in a barrel."
5055,4,"Godard has never made a better film than this unexpectedly moving meditation on love, history, memory, opposition and artistic transcendence."
5056,2,"The impulse which has led to this project... is commendable, but the results are inconsistent."
5057,3,"Barren, but strangely compelling."
5058,0,-LRB- 倫-RRB- rather faintly designed film.
5059,1,"""Moore is like a progressive bull from the porcelain shop; he is a provocateur who crushes ideas and interests while trying caption his own form of liberalism."""
5060,0,"'Bad 'is the disparate word for ""bad company,"" and I don't mean well."
5061,3,"Henry Bean's ingenious screenplay offers no simple answers, but offers compelling examinations of faith versus intellect"
5062,4,When you watch the film you are too interested.
5063,4,A weird and wonderful comedy.
5064,0,This is a crushingly unfunny and unoriginal mess!
5065,1,We have sharpness against farce; thoughtful dialogue that one-liners aside; and a visual style that for no apparent reason only works with rotoscope animation except maybe making it look very good.
5066,1,"Behaviour is interesting, but it is just too much."
5068,2,"A brieffcase size Goodfellas intended to appeal to younger audiences, not a very good movie objectively, but one with the same jailness."
5069,1,Funny and pointless.
5070,3,The film usually holds up quite well.
5072,3,"A completely solid gangster film with plenty of suspense, fascinating characters and bizarre bank robberies plus a good deal of father-and-son dynamics."
5073,1,"That's chatty, but no more ridiculous than most. """""
5074,4,"A colorful and cheerful celebration of life; a carpet of romance, dance, singing and unforgettable characters."
5075,4,Spiced up with witty dialogues and imaginative moments.
5076,4,"Taken properly, Wilde's play is a masterpiece of elegant all-purpose design."
5077,4,... engrossing fun and exquisite application.
5079,3,"Luxuriously silly, sweet, and occasionally hilarious -- anyone with a love of the quirky takes refuge in it."
5080,3,once in a while a movie turns me into the annoying human specimen I usually shied away from memorably seeing - the fanboy
5081,3,Great acclaimed play by Hitchcock.
5082,1,A bizarrely bitchy goings-on mocking the Lone Star State at the expense of popularity and small-town ridiculing.
5084,4,"The whole fabric is mesmerized, and Mr. Mattei nurtures moments of spontaneous intimacy."
5085,4,"Tunney, full of colored neurotic energy, holds the screen like a real star."
5086,2,"""Enigma"" is the infectious history drama that Hollywood seems to have discarded in favor of sentimental warfilms like ""We Were Soldiers."""
5087,4,Half Past Dead is just such an achievement.
5088,4,"In short, IMAX is wonderful on screen, too."
5089,3,A real pleasure.
5090,0,It's just pretty leaden and boring.
5091,4,"Those who like whimsical, weird films, and irony, should get their money's worth."
5092,4,"An entertaining and unexpected knowledge-rich examination of sexual jealousy, resentment and the tight balancing act between passion and illusion."
5093,3,He manages to exert Angelina Jolie's surprising flair for self-deprecation comedy.
5094,3,Cinemas will be pleased to hear these pictorial verbal jokes as much as the film's verbal reflections on anything from Miramax boss Harvey Weinstein's weird personal style to the stylistic tenacity of Danish dogma.
5095,2,"There are problems that even three Oscar-winners can't solve, but it's a nice girl buddy movie once it gets going."
5096,4,There is no denying that storytelling has value.
5097,2,"It's obvious that ""LRB Je-Gyu"" is trying to poetry; instead, he wears the all-encompassing lyric of a limerick scrawling around a public toilet."
5098,2,"If there's one big point about this promise, it is that nothing can change so long as there are physical and psychological barriers preventing the sides from speaking a single word to each other."
5101,4,"A spectacle of shrill sounds, which is about a wild and woolly, wall-to-wall good time."
5102,1,"The final hour of the film, which contains virtually everything previously unseen, is an unconvincing soap opera that Tornatore really has edited."
5103,3,"As those in the 1950s sci-fi movies called it, this is a homage to Shyamalan's gifts, which lead us to watch the skies repeatedly for his next project."
5104,2,I can't.
5106,2,"At worst Grillo is quietly genuine, but at best he is being a careful observer of the fatherly tendencies of a young artist."
5108,1,Unwieldy.
5109,0,"The lack of personality permeates every aspect of the film, from the TV film-like, from child actors to the most boring Irish pub scenes ever filmed."
5110,3,Shows how important our special talents can be if they serve others.
5112,3,"The usually good-natured Mr. Deeds, his endorsement of sheer kindness and camels of less - though probably $1 million - celebrities... certainly lift the film above everything Sandler has cherished in the past."
5113,4,"The pursuit of redemption makes for a touching love story, especially because Blanchett and Ribisi join in tribulations to an intelligent aspect of their characters ""suffering."
5114,2,Martin Scorsese's Gangs of New York is as flawed as it is tentative as his life-long work since GoodFellas.
5115,4,"The ghetto in Shanghai may not be as dramatic as Roman Polanski's The Pianist, but the spirit of compassion is soaring even higher."
5116,3,"Like the original, this version is slightly immersed in children's imagination thanks to Allen's sharp wit."
5118,1,It's like a brilliant melodrama that sometimes borders on camp.
5120,4,The trailer went on a rampage.
5121,1,"Director Roger Kumble seems to have abandoned a slew of storylines in favour of... outrageous gags, as he tries to slim the film down to a breezily quick 84 minutes."
5122,3,A singular sensual metaphor of sexual obsession expends a little too much time in the rather ludicrous plot.
5123,1,Feels really like a short stretch-to-feature length.
5125,4,"... bright, intelligent and humanly funny film."
5126,1,"If only, well, it were funnier."
5127,3,An encouraging effort from McCrudden
5128,2,Oliveira seems to strive for representation in silent movies with each grieving composition.
5129,4,"Good, solid storytelling."
5130,3,"There is a freedom to watch stunts that are so raw, so fast-paced and so mad."
5131,0,So boring that even his target audience kept talking.
5132,1,The kind of dumbing-down cliché exercise that gives the # LRBCteen comedy # RRB- a bad name.
5133,0,"... an airless, pre-packaged Julia Roberts wannabe who smells so much like @ Bild rabble that one wonders whether Lopez's publicist should make the scriptwriter his own."
5134,4,"Fueled by a fantastical double role from Ian Holm... this film is funny, sensitively human and a wonderful lark for history buffs."
5135,3,A crime scene as relentless as guessing who's going to make it to the finale.
5136,3,"Cage makes an unusual, but pleasantly striking debut behind the camera."
5138,3,"Even before it developed into an incredibly scenographed ballroom scene, in which 3000 actors perform in full armour, he has already made his way expertly through the art film pantheon."
5140,2,Walsh is unable to deal with the many inconsistencies in Janice's behaviour or to compensate by the power of her charm.
5141,4,"Romantic, captivating and beautifully animated."
5142,4,"Judith and Zaza's expanded bedroom sequence is... so intimate and sensual, witty and psychologically self-revealing that here, most of what passes for sex in movies seems like cheap hysteria."
5143,4,"Without resorting to camp or parody, Haynes has Mitglieder- LRB like Sirk, but unlike RRB- transformed the rhetoric of Hollywood melodrama into something provocative, rich and strange."
5144,1,McTiernan's remake may be lighter from poster to poster - the sober original was as graceful as a tap-dancing rhinoceros - but it's just as dull and obvious.
5145,0,Even the hastily and amateurishly drawn animation cannot inspire.
5147,1,"Starting with an unfortunate premise, mopeds traverse a dreary, practically haphazard passage and end with a whimper."
5148,1,"Despite Auteuil's puerile performance, it's a rather listless walk on the centre of the studio, where the thematic irony is too obvious and the sexual politics too smug."
5150,3,"Poet, exciting documentary."
5152,1,"s taste for unimaginable split screens, stuttering editing and pompous references to Wittgenstein and Kirkegaard... mingles unpleasantly with the surreal material."
5153,0,"However, for all its insights into the dream world of teen life and its electronic expression by cyber culture, the film offers no answers to those who are looking to the 2 ½ hour film to make a coherent story."
5154,2,"Ultimate X is an amusement park, basically the kind of great returns you could've got with a subscription to ESPN magazine."
5155,1,"Like the Hanks character, it's a slow study: The plot is pitched stiffly into the whole tabloid press."
5157,0,"Less funny than it should be, and less funny than it thought."
5158,1,"An entertainment so enamored of its over-everything mythology that it no longer recognizes movie-goers ""need for real characters and compelling plots."
5159,4,Best indie of the year so far.
5160,2,"It's all quite a misshapen, good time..."
5161,1,Comes across like a bad imitation of the Bard.
5162,1,"Fumbling like this on television amounts to a kind of abstract guilt, similar to paying for good books that we unread and never heard of."
5163,4,"with its subject in a tasteful, intelligent way"
5165,3,"This film, which is truly about the assassination of John F. Kennedy, might have been inspired by Blair Witch, but its techniques are so new that the film never wants to hacky away from the genre."
5166,3,"While she lacks the authority of a genre jewel, this enthralling mixture of love and bloodshed does have a certain robustness."
5167,2,"Sean Penn, you owe Nicolas Cage an apology."
5168,4,I really like this movie.
5169,0,It is fitting that a film as artificial and soulless as The Country Bears owes its making to an animated film shot in Disneyland.
5170,1,Sweet Home Alabama is not as funny as it should be for a film advertised as a comedy.
5172,3,The film is illuminating about Kissinger's origins and history.
5173,4,... one of the most entertaining monster movies in ages...
5174,3,What makes the movie so special is its complete seriousness.
5175,1,"... instead, they lend themselves to ""Shakes The Clown,"" a far funnier film, with a similar theme and an equally great Robin Williams appearance."
5177,4,Features flash rock videos that combine solid action and spooky atmosphere.
5179,1,"That an entirely unconvincing performance denied -LRB Madonna's -RRB her own athleticism, accentuating every line, every fall."
5180,0,What might have been in the hands of Woody Allen and Mel Brooks - LRB- turns out to be comedic folly from the very beginning in this debut movie.
5181,0,The film sinks further and further into comedic meaninglessness.
5182,3,"This film is an act of spiritual belief - an eloquent, profound meditation on the essence of compassion."
5184,1,Insufferably naive.
5185,2,"The movie has too many places where it floats slippery underfoot, but it is decent entertainment for all the family and one that is especially suitable for the little ones."
5186,2,Your taste for Jonah - A Veggie Tales Movie might very well depend on your threshold for populations of the Holy Spirit.
5187,4,... a thoughtful what-if for heart and mind.
5188,4,Schnitzler does a good job and contrasts the slimness of the film present with the playful paranoia of the past of film.
5190,0,A disjointed mess of a film that is rarely as entertaining as it could have been.
5191,1,This film is so bad it's almost worth watching because it's so bad.
5193,1,"Full of hotels, highways and parking, combined with glimpses of nature and familial warmth Mails out is a tempered groan of despair about imprisonment in the labyrinth of modern life."
5194,1,"Star Trek used to be a terrible thing, but today it's a copy of it."
5195,3,"In Death to Smoochy, not Williams's customary tears and smiles, we get mockery and bile, and the spectacle is simply refreshing."
5196,0,"He should do many things, but he doesn't."
5197,3,"There's a lot written about the years when the psychedelic 60s grooved into the gay 70s, but words do not do the era justice."
5198,1,"Right now I couldn't help but feel the scriptwriters: ""Tap, tap, tap, tap, tap away,"" this script says."
5199,1,Solondz may be the only one who laughs at his own joke
5200,1,Writer and director Randall Wallace has bitten off more than he or any other could chew and his film creeps like a drunk driver in heavy traffic.
5201,3,"It doesn't get them there, but the effort is appreciated."
5202,3,"A brilliant and often harrowing look at damaged people, and how families can offer either despair or comfort."
5203,1,The insignia of I Spy is so familiar it could well be a repeat.
5204,4,The work with actors is particularly impressive.
5205,2,"When Reno is on the left of the liberal political spectrum, her tough, funny, if chaotic show is not so much subversive as gauche of today's hypocrisies."
5206,0,A sentimental mess that will never happen.
5207,3,Byler is too accomplished a filmmaker to make this story a romantic love triangle.
5208,1,It's not intentional.
5209,0,Awful.
5210,2,She cannot and will not escape her past.
5212,1,A really good premise peels off in the middle of the road.
5214,1,Despite the lush richness of each scene the figures never seem to compete with the power of their surroundings.
5216,2,A bit too derivative to stand alone as the Psychoprimathriller she purports to portray.
5218,2,Everything her title suggests is a crime scene from Tinseltown's assembly line.
5219,2,Just watch Bettany wriggle out.
5220,4,A vivid and compelling examination of how similar obsessions can dominate a family.
5221,2,"In this film, at least we see a study under the shadow of the opposites: the wide range of actors and the restricted range of a comedian."
5222,3,A well-put-together piece of city satire.
5223,4,"Remarkable for its excellent storytelling, its sparse, compressed character, its deep humanity, the book is an adventure story and a history lesson in one."
5224,0,Complicating and tedious.
5225,0,"What we have is a character facing the possibility eball's life is meaningless, meaningless, meaningless and meaningless in a film that is definitely meaningless and meaningless, void and without substance."
5228,1,"In the Hollywood versus Woo fight, it looks like Woo's a PO. dans"
5229,4,", The sum of all our fears, is just a well-made and satisfying thriller."
5232,0,An almost unbearably morbid love story.
5233,4,"Here, we are to set up a divine monument to the struggle of a single man to regain his life, dignity and music."
5234,2,"If you want to see teuil disaster from which you cannot look away, then look no further, for here it is."
5235,2,He's better than mid-range Steven Seagal but not as sharp as Jet Li on inline skiing.
5236,0,Like a soft drink that's been open too long: it's got too much syrup and too little powder.
5237,3,Hashiguchi uses the situation to provoke a Japan that is operating in an undercurrent of solitude and isolation.
5238,3,Children interested in this little-berry-stuff will probably be lucky.
5239,0,One of the worst films of 2002.
5240,0,"sad.... a cheat, lumpy ጵlike two days old porridge... Unfortunately the film-makers wined and dined on these ""unbearable"" projects!"
5242,3,"It is certainly an improvement on the first, since the blade doesn't take itself so deadly seriously."
5243,2,"This version transcends the nostalgia of the original for the communal cinematic experiences of yesteryear, and serves as a deeper insight into cinema's inability to stand up for the true escapist experiences."
5245,0,"Perhaps you are in luck, and you will have power cuts during your performance, so you can get your money back."
5247,3,"Country, people and narrative flow together in a stark portrait of repulsed motherhood and explored longing."
